{
  "route_id": "g0304-demo",
  "version": "1",
  "city_id": "demo-city",
  "access": "free_base",
  "distance_m": 500,
  "duration_min": 10,
  "free_stop_count": 1,
  "published": false,
  "stops": [
    {
      "id": "stop-1",
      "position": 0,
      "place_id": "place-1",
      "access_tier": "base",
      "story_base_id": "story-1-base"
    }
  ]
}
